{
  "schemaVersion": "1.0.0",
  "framework": {
    "namespace": "fcai",
    "title": "NHS Fellowship in Clinical AI Curriculum",
    "publisher": "Guy's and St Thomas' NHS Foundation Trust Clinical Scientific Computing",
    "description": "Educational framework for NHS frontline workers to develop clinical AI expertise alongside clinical roles.",
    "canonicalUrl": "https://gstt-csc.github.io/assets/docs/FCAI_Curriculum_v3.2.pdf"
  },
  "release": {
    "version": "3.2",
    "label": "Version 3.2 (Cohort 3)",
    "publicationYear": 2024,
    "effectiveFrom": null,
    "sourceUrl": "https://gstt-csc.github.io/assets/docs/FCAI_Curriculum_v3.2.pdf",
    "sourceDocumentLabel": "Clinical AI Curriculum v3.2 (Cohort 3, 2024)",
    "status": "verified_source",
    "locale": "en-GB",
    "verificationNote": "Public source and content verified on 12 August 2026. Faculty must confirm the canonical release for Cohort 5 or later before assignment.",
    "releaseNotes": "Initial oPortfolio package. Published cross-mappings remain at domain level; no objective-level equivalence is asserted."
  },
  "deliveryMethods": [
    {
      "stableId": "fcai.delivery.immersive_project",
      "code": "DM-01",
      "title": "Immersive clinical AI project",
      "description": "Supervised experiential project work in a live NHS clinical AI team, potentially including publication or research.",
      "sortOrder": 1
    },
    {
      "stableId": "fcai.delivery.workshop",
      "code": "DM-02",
      "title": "Small group workshops",
      "description": "Monthly interactive expert-led masterclasses that complement and extend other learning.",
      "sortOrder": 2
    },
    {
      "stableId": "fcai.delivery.e_learning",
      "code": "DM-03",
      "title": "E-learning",
      "description": "Didactic and self-paced modules, exercises, assignments and deadlines through programme-selected learning resources.",
      "sortOrder": 3
    },
    {
      "stableId": "fcai.delivery.networking",
      "code": "DM-04",
      "title": "Networking",
      "description": "Mentorship, peer learning, site visits, alumni events and pastoral faculty sessions.",
      "sortOrder": 4
    }
  ],
  "duties": [
    {
      "stableId": "fcai.duty.mdt",
      "code": "DU-01",
      "title": "Work in an agile multidisciplinary team",
      "description": "Work as a member of an agile multidisciplinary team including AI specialists, medical physicists, IT, health economists and clinicians.",
      "sortOrder": 1
    },
    {
      "stableId": "fcai.duty.stakeholders",
      "code": "DU-02",
      "title": "Communicate with clinical AI stakeholders",
      "description": "Communicate with hospital management, patients, clinicians, regulators and technology developers.",
      "sortOrder": 2
    },
    {
      "stableId": "fcai.duty.datasets",
      "code": "DU-03",
      "title": "Curate clinical datasets lawfully",
      "description": "Curate clinical datasets in accordance with data-protection law and regulation.",
      "sortOrder": 3
    },
    {
      "stableId": "fcai.duty.safe_deployment",
      "code": "DU-04",
      "title": "Deploy clinical AI safely",
      "description": "Deploy clinical AI in a safe, legal, equitable and effective way.",
      "sortOrder": 4
    },
    {
      "stableId": "fcai.duty.evaluate_workflows",
      "code": "DU-05",
      "title": "Evaluate clinical AI in workflows",
      "description": "Critically evaluate the performance of clinical AI in hospital workflows.",
      "sortOrder": 5
    },
    {
      "stableId": "fcai.duty.present_findings",
      "code": "DU-06",
      "title": "Present scientific findings",
      "description": "Present scientific findings in clinical AI including clinical trials and quality-improvement projects.",
      "sortOrder": 6
    },
    {
      "stableId": "fcai.duty.policy_standards",
      "code": "DU-07",
      "title": "Develop policy and standards",
      "description": "Understand and develop policies and standards for clinical AI regulation.",
      "sortOrder": 7
    }
  ],
  "domains": [
    {
      "stableId": "fcai.fundamentals",
      "code": "AF",
      "title": "AI Fundamentals",
      "description": "Algorithms, data, tools, training, optimisation, metrics and validation foundations.",
      "sortOrder": 1,
      "deliveryMethodRefs": [
        "fcai.delivery.e_learning",
        "fcai.delivery.immersive_project",
        "fcai.delivery.workshop"
      ],
      "objectives": [
        {
          "stableId": "fcai.fundamentals.algorithms",
          "code": "AF-01",
          "title": "Select and apply AI algorithms",
          "sourceText": "Understand and apply different types of AI algorithms for different tasks, including logistic regression, decision trees, support vector machines, random forest, K-means clustering, neural networks and Bayesian approaches.",
          "sortOrder": 1
        },
        {
          "stableId": "fcai.fundamentals.data_provenance",
          "code": "AF-02",
          "title": "Understand training-data provenance, quality and structure",
          "sourceText": "Understand data provenance, quality and structure requirements for training AI algorithms, including synthetic data, metadata, taxonomies, ontologies and standards.",
          "sortOrder": 2
        },
        {
          "stableId": "fcai.fundamentals.data_wrangling",
          "code": "AF-03",
          "title": "Perform data extraction and wrangling",
          "sourceText": "Perform data extraction and wrangling, including feature labelling and extraction, dimensionality reduction and normalisation.",
          "sortOrder": 3
        },
        {
          "stableId": "fcai.fundamentals.training_types",
          "code": "AF-04",
          "title": "Understand AI training types",
          "sourceText": "Understand types of training for AI algorithms, including supervised, unsupervised, reinforcement, ensemble, distributed and federated learning.",
          "sortOrder": 4
        },
        {
          "stableId": "fcai.fundamentals.languages_frameworks",
          "code": "AF-05",
          "title": "Use AI languages and frameworks",
          "sourceText": "Understand types of languages and frameworks used to create and analyse AI algorithms, including Python, R and SQL.",
          "sortOrder": 5
        },
        {
          "stableId": "fcai.fundamentals.optimisation",
          "code": "AF-06",
          "title": "Train and optimise algorithms",
          "sourceText": "Understand and apply AI algorithm training and optimisation, including hyperparameter tuning, internal validation and optimal stopping.",
          "sortOrder": 6
        },
        {
          "stableId": "fcai.fundamentals.metrics",
          "code": "AF-07",
          "title": "Apply algorithm performance metrics",
          "sourceText": "Understand and apply common AI algorithm performance metrics, including precision, recall, F1 score and Receiver Operator Characteristic.",
          "sortOrder": 7
        },
        {
          "stableId": "fcai.fundamentals.validation_methods",
          "code": "AF-08",
          "title": "Understand validation methods",
          "sourceText": "Understand AI algorithm validation methods, including hold-out and cross-validation.",
          "sortOrder": 8
        }
      ]
    },
    {
      "stableId": "fcai.regulation",
      "code": "RS",
      "title": "Regulation & Standards",
      "description": "Medical-device regulation, data protection, clinical risk, research governance and law.",
      "sortOrder": 2,
      "deliveryMethodRefs": [
        "fcai.delivery.immersive_project",
        "fcai.delivery.workshop"
      ],
      "objectives": [
        {
          "stableId": "fcai.regulation.device_marking",
          "code": "RS-01",
          "title": "Understand medical-device marking and certification",
          "sourceText": "Understand CE and UKCA marking and methods for obtaining certification for different classes of medical device for AI technology.",
          "sortOrder": 1
        },
        {
          "stableId": "fcai.regulation.gdpr",
          "code": "RS-02",
          "title": "Apply GDPR to AI technology",
          "sourceText": "Understand and apply GDPR to AI technology.",
          "sortOrder": 2
        },
        {
          "stableId": "fcai.regulation.clinical_risk",
          "code": "RS-03",
          "title": "Apply clinical risk-management standards",
          "sourceText": "Understand and apply NHS clinical risk-management standards to AI technology, including DCB0129 and DCB0160.",
          "sortOrder": 3
        },
        {
          "stableId": "fcai.regulation.research_governance",
          "code": "RS-04",
          "title": "Apply research and service-evaluation governance",
          "sourceText": "Understand and apply HRA definitions of clinical research and service evaluation to AI evaluation and implementation, following the appropriate governance for each.",
          "sortOrder": 4
        },
        {
          "stableId": "fcai.regulation.legal_frameworks",
          "code": "RS-05",
          "title": "Understand AI clinical decision-making law",
          "sourceText": "Understand legal frameworks applying to AI technology in clinical decision making, including negligence, product liability and consent.",
          "sortOrder": 5
        }
      ]
    },
    {
      "stableId": "fcai.validation",
      "code": "VE",
      "title": "Validation & Evaluation",
      "description": "Evidence appraisal, local validation, monitoring, incidents, error and bias.",
      "sortOrder": 3,
      "deliveryMethodRefs": [
        "fcai.delivery.immersive_project",
        "fcai.delivery.workshop",
        "fcai.delivery.e_learning"
      ],
      "objectives": [
        {
          "stableId": "fcai.validation.literature",
          "code": "VE-01",
          "title": "Critically appraise AI literature",